CANCELLED -Musical Performance:From Iran-Ensemble Raah (New york debut)	Alwan for the Arts	16 Beaver Street,	New York, NY, 10004	Sep 18, 9:00 PM	An outstanding group of musicians from Iran, Ensemble Raah (a Farsi-Arabic word for "scent") makes its New York debut performing classical and folkloric Persian music, with part of the evening dedicated solely to percussion.    The Musicians    Alireza Alizadeh  Ali Bahramifard  Ali Geramifar  Samer Habibi  Mohammadreza Mazandarani   Maliheh Moradihaghighi  Nooshin Pasdar  Samira Taghikhani	http://www.nyc.com/events/cancelled_musical_performancefrom_iranensemble_raah_new_york_debut.1066138/editorial_review.aspx	20.0
Steak With A Side Of Jazz	Gallagher's Steak House	228 W 52nd St,	New York, NY, 10019	Sep 18, 9:00 PM	Dinner at Gallagher's Steak House (228 West 52nd Street) will be "jazzed up" in 2010 as 18-year-old Rhys Tivey and his rotating quartet will showcase their talents every Friday and Saturday night at the famed New York eatery.  The performances are from 9 p.m. - midnight on those two nights.  For reservations, patrons can contact 212-245-5336 and mention JAZZ to be seated accordingly. A two drink m read more...	http://www.nyc.com/events/steak_with_a_side_of_jazz.1048530/editorial_review.aspx	0
D'or Saturdays presented by gopartynyc.com	D'or	204 West 55th Street,	New York, NY, 10022	Sep 18, 10:00 PM	gopartynyc.com Presents  Socialite Saturdays at D'or Nightclub    Every Saturday NYC's Best DJ's Spin at New York's Sexiest Party    2 Floors Of Dance, Hip Hop, House & Mash-Ups    Open Bar 10-11pm  2 For 1 Drinks 11pm-12am  Bottle Specials All Night!    Ladies Free Till Midnight On The Go Party NYC List  Men $20 All Night On The List    You Must Ask For the Go Party NYC List at the Door    For Mo read more...	http://www.nyc.com/events/dor_saturdays_presented_by_gopartynyccom.1053927/editorial_review.aspx	0
Matt Hires	City Winery	143 Varick St.,	New York, NY, 10013	Sep 18, 10:00 PM	Matt Hires	http://www.nyc.com/events/matt_hires.1065379/editorial_review.aspx	35.0
OSCAR G. | LIVE FROM NYC CD RELEASE | Saturday September 18 @ Pacha NYC	Pacha	618 W 46th St,	New York, NY, 10036	Sep 18, 10:00 PM	Saturday September 18  Pacha NYC presents...    "Live from NYC" CD Release Party   Out Now on Nervous Records!    with music by  OSCAR G     Our favorite Miami export returns to his second home: The Pacha DJ booth. Infusing the Afro-Cuban sounds of his native city with New York's dark grooves, Oscar always makes you feel like it's March. Check out "Live From NYC," his upcoming mix CD on Nervous Re read more...	http://www.nyc.com/events/oscar_g__live_from_nyc_cd_release__saturday_september_18__pacha_nyc.1066872/editorial_review.aspx	10.0
Saturday's	Quo Nightclub (Grand Re-Opening) - Vegas guestlist			Sep 18, 10:30 PM	Saturday's @ The Return of Quo Nightclub 6/19 - Vegas guestlist  Start Time:   Saturday, June 19, 2010 at 10:30am  End Time:   Sunday, June 20, 2010 at 4:00am  Location:   Quo Nightclub  Street:   511 West 28th Street  City/Town:   New York, NY  View Map  Description     Vegas Lifestyle Presents...    It's the moment you've all been waiting for... QUO re-opens this Saturday Night!    So it's time  read more...	http://www.nyc.com/events/saturdays__quo_nightclub_grand_reopening__vegas_guestlist.1060632/editorial_review.aspx	0
Suzie Wong Saturdays presented by gopartynyc.com	Suzie Wong	547 Wet 27th Street,	New York, NY, 10001	Sep 18, 10:30 PM	GoPartyNYC.com Presents New York's Premiere Saturday Party...  True Saturdays at Suzie Wong      Doors Open 10:30pm  Everyone Free Till Midnight  2 For 1 Drinks 10:30pm-12am  Grey Goose and Hennessey $250 Till 1am    Music By  BIG BEN & DJ VELZ  spinning Hip Hop, R&B, House and Mash-Ups    You Must Ask For The Go Party NYC List at the Door    For More Information or Guestlist Call Us Toll Free at  read more...	http://www.nyc.com/events/suzie_wong_saturdays_presented_by_gopartynyccom.1053926/editorial_review.aspx	0
Pavement	The Williamsburg Waterfront - Brooklyn	North 8th St & Kent Ave On The East River,	Brooklyn, New York, 11211	Sep 19, 7:00 PM	Stephen Malkmus and the indie-rock legends Pavement reunite for a series of Central Park concerts for SummerStage.	http://www.nyc.com/events/pavement.1053924/editorial_review.aspx	23.0
Sage Francis	Stereo	512 West 29th Street,	New York, New York, 10001	Sep 19, 7:00 PM	Like so many great songwriters before, from Lightening Hopkins to Bob Dylan and beyond, Francis uses his gifted wordplay for a much greater good, creating vivid narratives and heartfelt confessionals which both instigate and inspire. With Li(f)e he has delivered a masterfully original and entirely essential work for the times.	http://www.nyc.com/events/sage_francis.1051776/editorial_review.aspx	0
Superchunk	Music Hall of Williamsburg	66 N. 6th St.,	Brooklyn, NY, 11211	Sep 19, 8:00 PM	Perhaps no band was more emblematic of the true spirit of American indie rock during the 1990s than Superchunk, the pride of Chapel Hill, NC. Following the D.I.Y. ethic to the letter, the group operated solely by their own rules, ignoring all passing trends by sticking to their trademark sound -- typified by the buzzing guitars and high, impassioned vocals of frontman Mac McCaughan -- and rejectin read more...	http://www.nyc.com/events/superchunk.1062715/editorial_review.aspx	33.0
Performing Arts Marathon 2010	IATI Theater	64 East 4th Street,	New York, NY, 10003	Sep 19, 12:00 AM	A 3-WEEK MULTI-CULTURAL FESTIVAL / OVER 150 ARTISTS  14 NATIONAL & INTERNATIONAL PRODUCTIONS IN DANCE, MUSIC AND THEATER    IATI Theater presents its 3rd Summer Festival, created to honor diversity and creativity in all performing art disciplines, as it gives talented new artists a chance to showcase their crafts.  Through this festival, IATI opens its doors to small companies and independent arti read more...	http://www.nyc.com/events/performing_arts_marathon_2010.1058275/editorial_review.aspx	15.0
Caribbean Sunday Brunch Party	Negril Village	70 W 3rd St,	New York, NY, 10012	Sep 19, 11:00 AM	Join us each and every Sunday in the West Village for the Caribbean Brunch Party! Experience a brunch party like no other, Sunday mornings will never be the same.    Mix, Mingle, and celebrate Sunday style. Perfect for birthdays and celebrations of all kinds. Featuring specially selected guest DJ's and our new brunch menu    Experience Brunch Caribbean Style!	http://www.nyc.com/events/caribbean_sunday_brunch_party.1049827/editorial_review.aspx	0
Music Manuscripts & Printed Music - Morgan Library & Museum	Morgan Library and Museum	225 Madison Avenue,	New York, NY, 10016	Sep 19, 11:00 AM	The Morgan Library & Museum houses one of the finest collections of music manuscripts in the country. In addition to a large collection of musicians' letters and first editions of scores and librettos, it has the world's largest collection of Mahler manuscripts and substantial holdings of Brahms, Chopin, Debussy, Mozart, Schubert, and Richard Strauss. The collection spans six centuries and many co read more...	http://www.nyc.com/events/music_manuscripts__printed_music__morgan_library__museum.1039099/editorial_review.aspx	0
Patti Smith	Morgan Library and Museum	225 Madison Avenue,	New York, NY, 10016	Sep 19, 11:00 AM	Hall of Famer Patti Smith continues to tour well into her storied and acclaimed career of music, writing, art and touring with her band.	http://www.nyc.com/events/patti_smith.1041999/editorial_review.aspx	128.0
Private Dance Lesson SALE: $45 Individual OR $55 Couple; Expires 9/30	ROY ARIAS DANCE STUDIOS	218 WEST 37th STREET ,	NEW YORK, N.Y., 10018	Sep 19, 12:00 PM	Lock-In on the Special Limited Time Offer of the SALE Price on the Private Dance Lessons. Pre-paid programs allow us to reserve time for you on our calendar. You have until Friday, December 31, 2010 to use the private lesson hours. These lessons may be used in whatever manner fits your schedule. Book early for best selection of dates & times.     Experienced Professional Dance Instructor with 12 Y read more...	http://www.nyc.com/events/private_dance_lesson_sale_45_individual_or_55_couple_expires_930.1067059/editorial_review.aspx	45.0
Wedding Dance Lesson Or First Dance Choreography for $55-$65; SALE Ends 9/30	ROY ARIAS DANCE STUDIOS	218 WEST 37th STREET ,	NEW YORK, N.Y., 10018	Sep 19, 12:00 PM	If you have planned all the details for the perfect wedding, it is time to think about making your first dance together just as perfect. You'd better not leave it to chance! Our Dance Studio works exclusively with brides and grooms, their families and friends and we create hundreds of uniquely choreographed wedding dances each year. Wedding packages consist of a series of private lessons which are read more...	http://www.nyc.com/events/wedding_dance_lesson_or_first_dance_choreography_for_5565_sale_ends_930.1067058/editorial_review.aspx	55.0
Sunday Gospel Brunch	B.B. King Blues Club & Grill	243 W 42nd St,	New York, NY, 10036	Sep 19, 1:30 PM	Every Sunday, for the past 8 years, the Harlem Gospel Choir has brought their experience of Harlem & the Black Church to New York's Times Square in a foot-stomping, hand-clapping, joyous gospel show.    The home-style "all you can eat" soul-food buffet is continuously refilled, & the Choir's uplifting performance will have you dancing on the stage. It's a wonderful way to experience the joy of the read more...	http://www.nyc.com/events/sunday_gospel_brunch.1039587/editorial_review.aspx	40.0
Bachata Beginner Workshop on Sunday, September 19; No Partner Needed; Register Today!	ROY ARIAS DANCE STUDIOS & THEATERS	300 WEST 43 STREET ,	NEW YORK, N.Y., 10036	Sep 19, 2:00 PM	(GET $20 DISCOUNT WITH ONLINE PRE-PAYMENT REGISTRATION BY FRIDAY, SEPTEMBER 17 & ONLY PAY $30)     BREAK TIME 4PM-5PM     DESCRIPTION: The 4-Hour Bachata Workshop is for a busy individual who simply cannot commit to the usual 4-8 Week Sessions offered at most studios, this is a great way to fit learning Bachata into your schedule. This workshop is designed for those who have never danced before or read more...	http://www.nyc.com/events/bachata_beginner_workshop_on_sunday_september_19_no_partner_needed_register_today.1067061/editorial_review.aspx	30.0
Family Time with Ziggy Marley	Skirball Center For The Performing Arts	566 LaGuardia Place,	New York, NY, 10012	Sep 19, 3:00 PM	Reggae icon, and 2010 Grammy winner for Best Musical Album for Children, Ziggy Marley shares his love for family and music while kicking off the 2010/2011 Big Red Chair Family Series!     âMusic helps children to grow with open minds and open hearts and this is my message. Family Time is for all families and especially the world family.â âZiggy Marley    Family Time represents the latest in Marley read more...	http://www.nyc.com/events/family_time_with_ziggy_marley.1065138/editorial_review.aspx	22.0
Million Dollar Quartet	Nederlander Theater	208 W 41st St,	New York, NY, 10036	Sep 19, 3:00 PM	On December 4, 1956, Elvis Presley, Johnny Cash, Jerry Lee Lewis and Carl Perkins gathered at Sun Records in Memphis for what would be one of the greatest jam sessions ever. Million Dollar Quartet brings that legendary night to life, featuring a score of rock hits that includes "Blue Suede Shoes," "Fever," "That's All Right," "Sixteen Tons," "Great Balls of Fire," "Walk the Line," "Whole Lotta Sha read more...	http://www.nyc.com/events/million_dollar_quartet.1038505/editorial_review.aspx	76.0
Sean "Diddy" Combs & Friends July 4th 13 Hour Celebrity Pool Party Bash in Atlantic City, NJ				Sep 19, 3:00 PM	Sean "Diddy" Combs 13 Hour Pool Party Bash 4th of July Celebration  Start Time:   Sunday, July 4, 2010 at 3:00pm  End Time:   Monday, July 5, 2010 at 4:00am  Location:   The Pool at Harrah's in Atlantic City, NJ  Street:   777 Harrah's Boulevard  City/Town:   Atlantic City, NJ  View Map  Description     CALL ME FOR TICKETS 702-503-2172  ****TICKETS IN HAND FOR SALE $50 NOW BEFORE PRICES RISE****** read more...	http://www.nyc.com/events/sean_quotdiddyquot_combs_amp_friends_july_4th_13_hour_celebrity_pool_party_bash_in_atlantic_city_nj.1060633/editorial_review.aspx	0
Strings of the Black Sea: A Celebration of Music from Bulgaria, Ukraine, Crimea, and Turkey	Grace Rainey Rogers Auditorium	1000 Fifth Avenue,	New York, NY, 10028	Sep 19, 3:00 PM	"Strings of the Black Sea" celebrates New York's cultural diversity through the exploration of musical connections between communities surrounding the Black Sea and their New York immigrant populations.	http://www.nyc.com/events/strings160of160the160black160sea160a160celebration160of160music160from160bulgaria160ukraine160crimea160and160turkey.1063008/editorial_review.aspx	30.0
Visual Arts and Jazzfest 2010--Jazz Moods and Melodies				Sep 19, 3:00 PM	A two and a half month long exhibition dedicated to jazz music, presented in over five venues in Manhattan and Brooklyn (Dorsey's Art Gallery, Blue Gem/Dr. English Building (The Paul Robeson Annex), Citibank Financial Center @ 144th St, Con Edison Lobby Gallery, & the Harlem Branch Library), including gallery talks, music/live art performances, panel discussions, an art/mural workshop at the Harle read more...	http://www.nyc.com/events/visual_arts_and_jazzfest_2010jazz_moods_and_melodies.1065268/editorial_review.aspx	0
Open Mic at Pete's Candy Store	Pete's Candy Store	709 Lorimer St,	Brooklyn, NY, 11211	Sep 19, 5:00 PM	Join Hosts Bruce Martin and Yvette Perez in Pete's intimate music room for a lively night of performances. Open Mic at Pete's has been running for over 9 years and has provided a springboard for many a NY performer now booking gigs around the city and beyond.    Performers are allowed 2 songs. Most performers are singer songwriters. We do not sign up full bands or performers who sing to track. We  read more...	http://www.nyc.com/events/open_mic_at_petes_candy_store.1039623/editorial_review.aspx	0
Sunday's Best @ The World Famous Negril Village	Negril Village	70 W 3rd St,	New York, NY, 10012	Sep 19, 5:00 PM	Starting this Sunday and every Sunday after, Vybz Entertainment, The World Famous (and Manhattan's best) DJ Commish, and Mad Architect Music presents:            **S U N D A Y 'S     B E S T****    @ the world famous NEGRIL VILLAGE inside the Rhum Lounge (DOWNSTAIRS). ADMISSION IS ABSOLUTELY FREE!!!! $6 RUM PUNCH SPECIALS ALL NIGHT. (If you never had a Negril's rum punch it is worth the trip!) And read more...	http://www.nyc.com/events/sundays_best__the_world_famous_negril_village.1047433/editorial_review.aspx	0.0
Local Correspondents Open Mic	Matchless	557 Manhattan Ave,	Brooklyn, NY, 11222	Sep 19, 6:30 PM	The Matchless open mic is hosted by Tanya Buziak (www.myspace.com/buziak). Every Sunday, musicians from Brooklyn and beyond line-up to play at this ex-motorcycle shop turned bar. Matchless is also one of the hottest new live music venues in Brooklyn. Starting around 6:30pm Sunday evenings, sign-up with our host Tanya Buziak. Tanya will allow you to pick your spot based on the order you arrive (fir read more...	http://www.nyc.com/events/local_correspondents_open_mic.1039631/editorial_review.aspx	0
Sea Wolf	The Mercury Lounge	217 E Houston St,	New York, NY, 10002	Sep 19, 7:00 PM	Sea Wolf	http://www.nyc.com/events/sea_wolf.1038496/editorial_review.aspx	261.0
Singer-Songwriter Sessions	The Bitter End	149 Bleecker St,	New York, NY, 10012	Sep 19, 7:00 PM	The Bitter End presents a weekly acoustic show with New York's best singer-songwriters, every Sunday night.	http://www.nyc.com/events/singersongwriter_sessions.1039622/editorial_review.aspx	5.0
Crash Course Karaoke	Kenny's Castaways	157 Bleecker St,	New York, NY, 10012	Sep 19, 8:00 PM	Enjoy karaoke with a live band!	http://www.nyc.com/events/crash_course_karaoke.1039620/editorial_review.aspx	0
Guitar Hero at Living Room Lounge	Living Room Lounge	245 23rd St,	Brooklyn, NY, 11215	Sep 19, 8:00 PM	Join the folks at the Living Room Lounge in Brooklyn for some Guitar Hero competition!	http://www.nyc.com/events/guitar_hero_at_living_room_lounge.1039626/editorial_review.aspx	0
Jeffrey Gaines And The Kennedys	City Winery	143 Varick St.,	New York, NY, 10013	Sep 19, 8:00 PM	Jeffrey Gaines And The Kennedys	http://www.nyc.com/events/jeffrey_gaines_and_the_kennedys.1065287/editorial_review.aspx	52.0
Tell Hell I Ain't Comin'  - The Musical	Sylvia & Danny Kaye Playhouse	695 Park Ave,	New York, NY, 10021	Sep 19, 8:00 PM	Marcia Samuels Productions is proud to present the nationally acclaimed musical, Tell Hell I Ain't Comin' at the Kaye Playhouse at Hunter College in New York City. Opening Night is September 15, 2010. Returning to New York City due to overwhelming popular demand following showcase performances in Brooklyn and Queens, Tell Hell I Ain't Comin' is a thrilling Broadway caliber musical that has enterta read more...	http://www.nyc.com/events/tell160hell160i160aint160comin160160_the160musical.1062991/editorial_review.aspx	0
The World Premiere of Talk Like Singing: A Japanese Musical Starring Shingo Katori	The Jack H. Skirball Center	566 Laguardia Pl.,	New York, NY, 10012	Sep 19, 8:00 PM	Talk Like Singing, a groundbreaking production and the first-ever original Japanese musical to have its premiere in the U.S., will have its world premiere in New York City on November 13, 2009 at 8:00 P.M. at New York Universityâs Skirball Center. The show will run through November 22.  The talented Koki Mitani has written and directs this comedic new material spoken in both Japanese and English.  read more...	http://www.nyc.com/events/the_world_premiere_of_talk_like_singing_a_japanese_musical_starring_shingo_katori.1045275/editorial_review.aspx	0
Ziggy Marley	Skirball Center For The Performing Arts	566 LaGuardia Place,	New York, NY, 10012	Sep 19, 8:00 PM	Generations of listeners have long embraced the music of Jamaican singer/songwriter Ziggy Marley, who was immersed in music as a child when he sat in on recording sessions with his father, reggae legend Bob Marley. Over the years, his work has proven his versatility and universality as an artist.    As front man of The Melody Makers, Ziggy released eight best-selling albums generating three Grammy read more...	http://www.nyc.com/events/ziggy_marley.1065137/editorial_review.aspx	35.0
Jazz at the Lyceum	Brooklyn Lyceum	227 4th Avenue,	Brooklyn, NY, 11215	Sep 19, 9:00 PM	Every Wednesday and Sunday the Lyceum hosts different, talented jazz bands, with styles in the full range of traditional to current to avant garde. Each night features two back-to-back sets.	http://www.nyc.com/events/jazz_at_the_lyceum.1039507/editorial_review.aspx	10.0
Open Mic at the Village Underground	The Village Underground	130 W 3rd St,	New York, NY, 10012	Sep 19, 9:15 PM	The Open Mic concept is not a new one, it has been tested and tried for many years in many venues all across the country. Aspiring artists take the spotlight on a small stage with local musicians and pour their hearts out in song - searching for stardom - reaching for their dreams.    The Ron Grant & Friends Open Mic Showcase at the Village Underground is no different. It imbues all of the same ta read more...	http://www.nyc.com/events/open_mic_at_the_village_underground.1039630/editorial_review.aspx	15.0
Performing Arts Marathon 2010	IATI Theater	64 East 4th Street,	New York, NY, 10003	Sep 20, 12:00 AM	A 3-WEEK MULTI-CULTURAL FESTIVAL / OVER 150 ARTISTS  14 NATIONAL & INTERNATIONAL PRODUCTIONS IN DANCE, MUSIC AND THEATER    IATI Theater presents its 3rd Summer Festival, created to honor diversity and creativity in all performing art disciplines, as it gives talented new artists a chance to showcase their crafts.  Through this festival, IATI opens its doors to small companies and independent arti read more...	http://www.nyc.com/events/performing_arts_marathon_2010.1058275/editorial_review.aspx	15.0
Private Dance Lesson SALE: $45 Individual OR $55 Couple; Expires 9/30	ROY ARIAS DANCE STUDIOS	218 WEST 37th STREET ,	NEW YORK, N.Y., 10018	Sep 20, 12:00 PM	Lock-In on the Special Limited Time Offer of the SALE Price on the Private Dance Lessons. Pre-paid programs allow us to reserve time for you on our calendar. You have until Friday, December 31, 2010 to use the private lesson hours. These lessons may be used in whatever manner fits your schedule. Book early for best selection of dates & times.     Experienced Professional Dance Instructor with 12 Y read more...	http://www.nyc.com/events/private_dance_lesson_sale_45_individual_or_55_couple_expires_930.1067059/editorial_review.aspx	45.0
Wedding Dance Lesson Or First Dance Choreography for $55-$65; SALE Ends 9/30	ROY ARIAS DANCE STUDIOS	218 WEST 37th STREET ,	NEW YORK, N.Y., 10018	Sep 20, 12:00 PM	If you have planned all the details for the perfect wedding, it is time to think about making your first dance together just as perfect. You'd better not leave it to chance! Our Dance Studio works exclusively with brides and grooms, their families and friends and we create hundreds of uniquely choreographed wedding dances each year. Wedding packages consist of a series of private lessons which are read more...	http://www.nyc.com/events/wedding_dance_lesson_or_first_dance_choreography_for_5565_sale_ends_930.1067058/editorial_review.aspx	55.0
Sean "Diddy" Combs & Friends July 4th 13 Hour Celebrity Pool Party Bash in Atlantic City, NJ				Sep 20, 3:00 PM	Sean "Diddy" Combs 13 Hour Pool Party Bash 4th of July Celebration  Start Time:   Sunday, July 4, 2010 at 3:00pm  End Time:   Monday, July 5, 2010 at 4:00am  Location:   The Pool at Harrah's in Atlantic City, NJ  Street:   777 Harrah's Boulevard  City/Town:   Atlantic City, NJ  View Map  Description     CALL ME FOR TICKETS 702-503-2172  ****TICKETS IN HAND FOR SALE $50 NOW BEFORE PRICES RISE****** read more...	http://www.nyc.com/events/sean_quotdiddyquot_combs_amp_friends_july_4th_13_hour_celebrity_pool_party_bash_in_atlantic_city_nj.1060633/editorial_review.aspx	0
Visual Arts and Jazzfest 2010--Jazz Moods and Melodies				Sep 20, 3:00 PM	A two and a half month long exhibition dedicated to jazz music, presented in over five venues in Manhattan and Brooklyn (Dorsey's Art Gallery, Blue Gem/Dr. English Building (The Paul Robeson Annex), Citibank Financial Center @ 144th St, Con Edison Lobby Gallery, & the Harlem Branch Library), including gallery talks, music/live art performances, panel discussions, an art/mural workshop at the Harle read more...	http://www.nyc.com/events/visual_arts_and_jazzfest_2010jazz_moods_and_melodies.1065268/editorial_review.aspx	0
Lyceum Open Mic	Brooklyn Lyceum	227 4th Avenue,	Brooklyn, NY, 11215	Sep 20, 7:00 PM	MC'ed by Quincy Vance, you can:    - sign up starting at 7pm. Music kicks off at 7:30.  Each performer gets 2 songs or 8 minutes    - SECOND HOUR WILL BE THEMED (starting in April)! We'll advertise a theme for a handful of Mondays in advance, and you get to write/cover/improvise a song based on that theme and debut it. Creative!  - minimal backline available (small guitar amp, a few mics, poss key read more...	http://www.nyc.com/events/lyceum_open_mic.1039512/editorial_review.aspx	0
Klaxons	Bowery Ballroom	6 Delancey St,	New York, NY, 10002	Sep 20, 8:00 PM	Klaxons	http://www.nyc.com/events/klaxons.1062985/editorial_review.aspx	44.0
Open Mic at Kenny's Castaways	Kenny's Castaways	157 Bleecker St,	New York, NY, 10012	Sep 20, 8:00 PM	Try out your latest songs or enjoy some homegrown local music!	http://www.nyc.com/events/open_mic_at_kennys_castaways.1039619/editorial_review.aspx	0
The Wailers	B.B. King Blues Club & Grill	243 W 42nd St,	New York, NY, 10036	Sep 20, 8:00 PM	The Wailers	http://www.nyc.com/events/the_wailers.1065397/editorial_review.aspx	250.0
The World Premiere of Talk Like Singing: A Japanese Musical Starring Shingo Katori	The Jack H. Skirball Center	566 Laguardia Pl.,	New York, NY, 10012	Sep 20, 8:00 PM	Talk Like Singing, a groundbreaking production and the first-ever original Japanese musical to have its premiere in the U.S., will have its world premiere in New York City on November 13, 2009 at 8:00 P.M. at New York Universityâs Skirball Center. The show will run through November 22.  The talented Koki Mitani has written and directs this comedic new material spoken in both Japanese and English.  read more...	http://www.nyc.com/events/the_world_premiere_of_talk_like_singing_a_japanese_musical_starring_shingo_katori.1045275/editorial_review.aspx	0
Tony Scherr & Special Guests	Jalopy Theatre & School Of Music	315 Columbia St,	Brooklyn, NY, 11231	Sep 20, 9:00 PM	Tony Scherr, one of NYCâs most in-demand guitar and bass players, plays a weekly gig at Jalopy! A great start to your week!    He is accompanied by his band, ROB JOST on bass, ANTON FIER on drums.    Tony plays integral roles in the music of such notable artists as Bill Frisell, John Lurie (Lounge Lizards), Steven Bernstein (Sex Mob), and Norah Jones, as well as some of New York's better-kept secr read more...	http://www.nyc.com/events/tony_scherr__special_guests.1039531/editorial_review.aspx	5.0
